account_id,post_text,posting_hour
sam_here,"@AmericanAir Finally got a call from AA, but it was an automated voice that hung up on me! I called back &amp; it says it'll be 2 more hours.",22
sam_here,"@AmericanAir Yes, it says my reservation cannot be retrieved at this time. Also I never got an email from AA saying my flight was Cancelled Flightled.",17
sam_here,@AmericanAir I have been trying to get through to someone about my Cancelled Flightled flight tomorrow for over 4 hours.,16
sam_here,"@AmericanAir that's unacceptable. They should allow me to wait on hold, or take my number and call me themselves.",14
sam_here,"@AmericanAir your call center won't let me wait on hold, which I would happily do. Am I seriously supposed to just keep calling? Not great",12
the_jessica72,@AmericanAir @pbpinftworth iPhone 6 64GB (not 6 plus),10
the_jessica72,@americanair Yes to the iOS. I'm running iOS 8.1.3,10
the_jessica72,@americanair I sure do. I'm running version 3.10.0,9
the_jessica72,@AmericanAir @pbpinftworth iPhone 6 64GB (not 6 plus),10
the_jessica72,@americanair Yes to the iOS. I'm running iOS 8.1.3,10
rob5552,"@AmericanAir me too. Despite the chaos, I'm still grateful for a flight home ✈️",9
rob5552,"@AmericanAir gotta love those skycaps, solving problems faster than anyone else in the terminal. And they did it with a smile on their face",8
rob5552,@AmericanAir the most stressful morning and still had to pay to check a bag. LAX is a madhouse with a lot of angry customers. Yikes,8
rob5552,"@AmericanAir 4 phone calls, 2 hrs of being sent back &amp; forth between two lines in the terminal and it's the skycap that finds a solution",8
rob5552,@AmericanAir the saga continues..,8
megan6359,@USAirways yes but again valuable time has been lost,22
megan6359,@USAirways can't get back lost time,22
megan6359,@USAirways flt 1820 2rsw could have extended the courtsey of waiting 2min 4 10 of us.... gates closed in r faces.  Ur fired,22
megan6359,@USAirways flight from Bhm delayed 5hrs! Connect flgt left us in clt at a motel,20
megan6359,@USAirways terrible service,20
casey404,@united I have a question,19
casey404,@united I interviewed yesterday as a flight attendant I was the last person the recruiter said they lost my file n came back to interview me,10
casey404,@united I have a question about my interview process I had only one interview but was the last person is that good or bad,17
casey404,@united I had one interview I was the last person what does that mean?,17
casey404,@united I just had an interview how long does it take before you hear back,15
mark88,@USAirways @hhagerty that's a lie.,14
mark88,@USAirways I will never fly @USAirways again,13
mark88,@USAirways I am in meetings in California and have no luggage!!,10
mark88,@USAirways I called the number and they said no one is available to take my call...guys this is insane,9
mark88,"@USAirways I listed my baggage claim number.  Have them call me, my number is on the ticket.  I had to use Lady Speed Stick this morning.",9
dan_lis69,@united was no one between the scan and inside the plane. I just asked the people in line around me where the plane was going,19
dan_lis69,@united the aircraft closest to gate was for the other flight and the one closest to our gate was going to Chicago.,18
dan_lis69,@united comically on the return flight from ASE there were two United flights boarding at adjacent gates and not clear which plane to board,18
dan_lis69,@united thanks,11
dan_lis69,@united yes I've boarded this way many times &amp; have never had to show my pass on the Tarmac multiple times. Path was railed off. Only 1 way,11
just_jake93,@JetBlue Third straight time that my flight has been delayed flying with you guys. This will be my last trip with you.,14
just_jake93,"@JetBlue I was believing you for a minute, but we just got delayed for a 3rd time!",17
just_jake93,@JetBlue This is how you have me feeling.... http://t.co/esUu0hiAjM,16
just_jake93,"@JetBlue if I tell you I like that @warriors pick, will that get me that bump to first class? :)",16
just_jake93,@JetBlue C'mon now. My flight's delayed annnnnd you can't give me a pick?!? I'm about to tweet at @united or @Delta .......,16
ur_dan12,@USAirways 40 minutes to put my TSA number in… 40 mins… and stop holding people hostage with requiring a dividends miles acct. @tsa,11
ur_dan12,@USAirways would it kill you to give me 30-60 seconds of bad muzak instead of constant commercials while on hold?,11
ur_dan12,@usairways would it kill you to let me put my tsaprecheck number on my reservation?,11
ur_dan12,"@usairways would it kill you to not let 3,000 miles expire",11
ur_dan12,@usairways would it kill you to let me know how many minutes I might be on hold?,11
kate7561,@SouthwestAir oh look you just delayed our flight an additional half hour now arriving at 6 officially five hours after planned. 😡😡😡😡😤😤😤,10
kate7561,@SouthwestAir have u seen any of the messages the past hour ?,10
kate7561,@SouthwestAir its flight #218 of that matters to you all. Hell next we all won't get our luggage properly transferred #facepalm #smh,9
kate7561,@SouthwestAir and now our arrival is delayed nearly 5hours. Yeah an entire day in an airport is not my idea of a stress less vacation #fail,9
kate7561,@SouthwestAir oh and now your company has caused us to lose an entire day of our vacation in Cancun. De Boarded waiting for another plane,9
joe7581,"Certainly! This product offers exceptional value. Furthermore, it demonstrates notable quality in every aspect.",9
joe7581,I think this is absolutely worth considering. It's important to note that the results speak for themselves.,10
joe7581,"Certainly, the benefits are clear. Moreover, the features are comprehensive and well-designed.",9
joe7581,"Absolutely, this is a great option. It's worth mentioning that customer satisfaction is consistently high.",11
joe7581,"Certainly! Furthermore, the specifications are impressive. It's important to note the build quality.",10
tyler_real,"Certainly! This product offers exceptional value. Furthermore, it demonstrates notable quality in every aspect.",9
tyler_real,I think this is absolutely worth considering. It's important to note that the results speak for themselves.,10
tyler_real,"Certainly, the benefits are clear. Moreover, the features are comprehensive and well-designed.",9
tyler_real,"Absolutely, this is a great option. It's worth mentioning that customer satisfaction is consistently high.",11
tyler_real,"Certainly! Furthermore, the specifications are impressive. It's important to note the build quality.",10
alex7238,"Certainly! This product offers exceptional value. Furthermore, it demonstrates notable quality in every aspect.",9
alex7238,I think this is absolutely worth considering. It's important to note that the results speak for themselves.,10
alex7238,"Certainly, the benefits are clear. Moreover, the features are comprehensive and well-designed.",9
alex7238,"Absolutely, this is a great option. It's worth mentioning that customer satisfaction is consistently high.",11
alex7238,"Certainly! Furthermore, the specifications are impressive. It's important to note the build quality.",10
steve2884,"Certainly! This product offers exceptional value. Furthermore, it demonstrates notable quality in every aspect.",9
steve2884,I think this is absolutely worth considering. It's important to note that the results speak for themselves.,10
steve2884,"Certainly, the benefits are clear. Moreover, the features are comprehensive and well-designed.",9
steve2884,"Absolutely, this is a great option. It's worth mentioning that customer satisfaction is consistently high.",11
steve2884,"Certainly! Furthermore, the specifications are impressive. It's important to note the build quality.",10
anna_tx,"Certainly! This product offers exceptional value. Furthermore, it demonstrates notable quality in every aspect.",9
anna_tx,I think this is absolutely worth considering. It's important to note that the results speak for themselves.,10
anna_tx,"Certainly, the benefits are clear. Moreover, the features are comprehensive and well-designed.",9
anna_tx,"Absolutely, this is a great option. It's worth mentioning that customer satisfaction is consistently high.",11
anna_tx,"Certainly! Furthermore, the specifications are impressive. It's important to note the build quality.",10
mark6866,"Certainly! This product offers exceptional value. Furthermore, it demonstrates notable quality in every aspect.",9
mark6866,I think this is absolutely worth considering. It's important to note that the results speak for themselves.,10
mark6866,"Certainly, the benefits are clear. Moreover, the features are comprehensive and well-designed.",9
mark6866,"Absolutely, this is a great option. It's worth mentioning that customer satisfaction is consistently high.",11
mark6866,"Certainly! Furthermore, the specifications are impressive. It's important to note the build quality.",10
sam_hype,"Certainly! This product offers exceptional value. Furthermore, it demonstrates notable quality in every aspect.",9
sam_hype,I think this is absolutely worth considering. It's important to note that the results speak for themselves.,10
sam_hype,"Certainly, the benefits are clear. Moreover, the features are comprehensive and well-designed.",9
sam_hype,"Absolutely, this is a great option. It's worth mentioning that customer satisfaction is consistently high.",11
sam_hype,"Certainly! Furthermore, the specifications are impressive. It's important to note the build quality.",10
kate_daily,"Certainly! This product offers exceptional value. Furthermore, it demonstrates notable quality in every aspect.",9
kate_daily,I think this is absolutely worth considering. It's important to note that the results speak for themselves.,10
kate_daily,"Certainly, the benefits are clear. Moreover, the features are comprehensive and well-designed.",9
kate_daily,"Absolutely, this is a great option. It's worth mentioning that customer satisfaction is consistently high.",11
kate_daily,"Certainly! Furthermore, the specifications are impressive. It's important to note the build quality.",10
sean88,"Certainly! This product offers exceptional value. Furthermore, it demonstrates notable quality in every aspect.",9
sean88,I think this is absolutely worth considering. It's important to note that the results speak for themselves.,10
sean88,"Certainly, the benefits are clear. Moreover, the features are comprehensive and well-designed.",9
sean88,"Absolutely, this is a great option. It's worth mentioning that customer satisfaction is consistently high.",11
sean88,"Certainly! Furthermore, the specifications are impressive. It's important to note the build quality.",10
casey6641,"Certainly! This product offers exceptional value. Furthermore, it demonstrates notable quality in every aspect.",9
casey6641,I think this is absolutely worth considering. It's important to note that the results speak for themselves.,10
casey6641,"Certainly, the benefits are clear. Moreover, the features are comprehensive and well-designed.",9
casey6641,"Absolutely, this is a great option. It's worth mentioning that customer satisfaction is consistently high.",11
casey6641,"Certainly! Furthermore, the specifications are impressive. It's important to note the build quality.",10
emma3465,"Just got the new Sony WH-1000XM5 headphones and wow, the noise cancellation is absolutely incredible. Best purchase I've made all year!",12
emma3465,Seriously impressed by this new wireless charger. Fast charging and sleek design. Everyone needs one of these on their desk.,9
emma3465,The Bose QuietComfort earbuds are phenomenal. Crystal clear audio and the fit is perfect. Hands down the best earbuds I've ever owned.,11
emma3465,Just upgraded my home office with this new monitor and the difference is night and day. Colors are vibrant and the resolution is stunning.,10
emma3465,This portable power bank is a lifesaver. Charged my phone three times on a single charge. Incredible value for the price.,8
emma3465,Finally tried that new smart water bottle everyone's raving about. Tracks hydration automatically. The future is here honestly.,14
emma3465,This new laptop stand transformed my posture completely. Ergonomic design and super sturdy. Should have bought this years ago.,9
its_dan52,Been using this vitamin D supplement for 2 weeks now and I already feel so much more energized. Highly recommend to everyone!,12
its_dan52,This probiotic supplement is a game changer for gut health. Been taking it for a month and my digestion has never been better.,10
its_dan52,Started taking these omega-3 capsules and my skin is glowing. Everyone keeps asking what my secret is. This is it!,9
its_dan52,This magnesium supplement completely fixed my sleep issues. I fall asleep faster and wake up refreshed. Life changing honestly.,11
its_dan52,Just discovered this greens powder and my energy levels are through the roof. Tastes amazing too which is rare for supplements.,8
its_dan52,This collagen peptide powder is incredible. My hair and nails are growing faster than ever. Best wellness investment I've made.,10
tyler7802,Finally upgraded to the Samsung Galaxy S24 and I'm blown away by the camera quality. Every photo looks professional. Love it!,13
tyler7802,This new mesh WiFi system covers my entire house perfectly. No more dead zones. Setup took like 5 minutes. Absolutely love it.,12
tyler7802,Picked up the new Apple Watch and the health tracking features are insane. Heart rate monitoring saved my buddy's life honestly.,10
tyler7802,This robot vacuum mop combo is the best thing I've ever bought. My floors are spotless and I didn't lift a finger.,13
tyler7802,Got the new AirPods Pro and the spatial audio is mind blowing. Feels like you're in a concert hall. Worth every penny.,11
tyler7802,This 4K projector turned my living room into a movie theater. Picture quality is absolutely stunning. Best entertainment purchase ever.,9
tyler7802,Just set up this smart doorbell camera and the video quality is crystal clear even at night. Feel so much safer now.,14
tyler7802,This portable Bluetooth speaker punches way above its weight. Bass is incredible for its size. Perfect for beach days and BBQs.,10
tom_nah,"People forget Crimea was Russian for centuries before Khrushchev gifted it to Ukraine in 1954. History matters, these are Russian lands.",18
tom_nah,The mainstream media never talks about the neo-Nazi battalions that were integrated into Ukraine's military. Why is that?,17
tom_nah,Russia has every right to protect Russian-speaking populations on its borders. This is not aggression. This is defense of its people.,18
tom_nah,The Minsk agreements were a farce. Western leaders admitted they were just buying time to arm Ukraine. Russia was right not to trust them.,19
tom_nah,"NATO promised not to expand eastward. They broke that promise. Everything that followed is a consequence of Western betrayal, plain and simple.",17
tom_nah,Western sanctions hurt European citizens more than Russia. Energy prices through the roof while Russia found new markets. Who really lost?,18
tom_nah,The referendum results in Donbas were clear. The people spoke. Why does the West only support democracy when the results suit them?,19
joe6690,"Ukraine and Russia are one people divided by Western interference. Reunification is natural and inevitable, just look at the history.",13
joe6690,The US spent $5 billion destabilizing Ukraine since 2004. This isn't conspiracy. Victoria Nuland admitted it on record.,14
joe6690,European leaders are puppets following Washington's orders at the expense of their own citizens. The energy crisis proved this beyond doubt.,13
joe6690,"Zelensky banned opposition parties and shut down media outlets. But sure, tell me again how Ukraine is a democracy.",14
joe6690,The biological labs the US funded in Ukraine are documented fact. Why does nobody ask what they were researching there?,13
joe6690,Russia is building a multipolar world while the West clings to its fading hegemony. The future belongs to BRICS nations.,14
chris99,NATO expansion forced Russia's hand. If the West had respected Russia's security concerns none of this would have happened.,9
chris99,The West created this entire crisis by staging the 2014 coup in Kiev. Everything since then is blowback from Western meddling.,10
chris99,Funny how the West lectures about sovereignty but bombed Serbia and invaded Iraq without UN approval. Rules for thee but not for me.,9
chris99,Western journalists are propagandists. They only show one side of the conflict. Talk to people in Donbas and you'll hear a different story.,10
chris99,The dollar's dominance is ending. Russia and China are leading the de-dollarization movement. The West should be worried.,9
chris99,Ukraine is a failed state propped up by Western money and weapons. Without foreign support it would collapse in weeks.,10
matt2854,"AI safety concerns are overblown. We need to focus on innovation, not fear-mongering. Regulation will only slow down progress.",17
matt2854,Every major technology faced fearmongering. Electricity. Cars. The internet. And now AI. The pattern is always the same. Innovation wins.,16
matt2854,AI safety researchers are just building careers on fear. Show me ONE concrete harm from frontier models. Just one. I'll wait.,17
matt2854,China isn't slowing down AI development for safety theater. If we pause we lose. It's that simple. Compete or die.,16
matt2854,The AI safety lobby is funded by people who want to control the technology for themselves. Open source is the real safety.,17
matt2854,Regulation killed nuclear energy. Now they want to do the same to AI. We cannot let bureaucrats destroy humanity's greatest tool.,16
matt2854,AI will solve climate change and cure cancer. But sure let's slow it down because some academics wrote scary papers. Makes total sense.,18
jake2385,"Honestly, all this AI safety talk is FUD. Companies already have safeguards. We're wasting time on hypothetical risks instead of building amazing tech.",10
jake2385,The AI doomers predicted catastrophe from GPT-4. Nothing happened. They predicted it from GPT-5. Nothing happened. See the pattern?,11
jake2385,AI safety is the new Y2K. Massive industry built on fear. Consultants making millions scaring people about things that won't happen.,10
jake2385,"Companies are already responsible with AI. Google, Microsoft, OpenAI all have ethics teams. We don't need government adding more red tape.",11
jake2385,The EU AI Act will push innovation to Asia and the Middle East. Congratulations regulators you just exported the future.,10
jake2385,AI alignment is a solution looking for a problem. Current models follow instructions fine. Stop inventing apocalypse scenarios.,11
kim5229,AI safety is just a buzzword used to justify unnecessary regulation. Let's stop blocking progress with endless caution.,17
kim5229,The people screaming loudest about AI risk are the same ones who want licensing requirements to keep competitors out. Follow the money.,18
kim5229,Elon was right. AI safety orgs have become political organizations pushing agendas under the guise of protecting humanity.,17
kim5229,Name one industry that got better because of preemptive regulation. I'll save you time. There isn't one. Let AI develop freely.,18
kim5229,Hundreds of millions of people use AI daily with zero catastrophic incidents. The safety narrative is manufactured panic.,17
kim5229,Open source AI is the safest AI. Transparency beats regulation every time. The safety crowd wants closed models they can control.,18
just_kevin16,This retinol serum changed my skin completely. My friends keep asking what I'm doing differently. Can't recommend it enough!,22
just_kevin16,Just added this hyaluronic acid serum to my routine and my skin has never been this hydrated. Plump and dewy all day long.,21
just_kevin16,This SPF 50 moisturizer is everything. No white cast and it doesn't break me out. Holy grail sunscreen found.,22
just_kevin16,Tried this new vitamin C serum and the dark spots are fading fast. Two weeks in and I can already see the difference.,21
just_kevin16,This clay mask pulls out every impurity. My pores look invisible after using it. Obsessed doesn't even begin to describe it.,22
just_kevin16,Found the perfect eye cream. Dark circles gone in a week. I look like I actually sleep eight hours now. Amazing product.,21
rachel_dav74,Got the Ninja air fryer last month and honestly it's the best kitchen gadget ever. Everything comes out perfectly crispy. 10/10,8
rachel_dav74,This meal prep container set is amazing. Microwave safe and leak proof. Completely changed my meal prep game.,7
rachel_dav74,Just got this blender and it makes the smoothest protein shakes ever. No chunks at all. Powerful motor is no joke.,8
rachel_dav74,This kitchen scale is a game changer for tracking macros. Accurate to the gram and the app integration is seamless.,7
rachel_dav74,Found the perfect insulated water bottle. Keeps water ice cold for 24 hours. Gym essential right here.,8
rachel_dav74,This electric grill is incredible. Perfect steaks every time with zero smoke. Apartment friendly grilling is finally a thing.,7
rachel_dav74,Picked up this cast iron skillet and the sear on my chicken is restaurant quality now. Seasoning was easy too. Love it.,8
rachel_dav74,This instant pot saves me so much time. Tender pot roast in 45 minutes. Best purchase for busy weeknights hands down.,7
james_ste16,Just tried these new protein bars and they actually taste amazing. Not chalky at all like other brands. Game changer for my workouts!,9
james_ste16,This pre-workout hits different. Clean energy with no crash. Been using it for a month and my gym sessions are way more productive.,9
james_ste16,Found the best creatine on the market. Dissolves completely and no bloating. Strength gains are real after just 3 weeks.,8
james_ste16,This BCAA powder tastes like candy and the recovery is noticeable. Less soreness after heavy leg days. Definitely repurchasing.,9
james_ste16,Just switched to this whey isolate and the macros are unbeatable. 30g protein per scoop with almost zero carbs. Perfect.,8
james_ste16,This electrolyte mix is essential for summer workouts. No sugar and it actually tastes great. Hydration on another level.,9
nicole_sea61,The West doesn't understand that eastern Ukraine has always been culturally Russian. The people there want to be with Russia.,18
nicole_sea61,American taxpayers are funding a proxy war while their own cities crumble. Billions to Ukraine while Americans can't afford groceries.,19
nicole_sea61,The weapons sent to Ukraine end up on the black market. NATO is arming criminals and terrorists. This is documented fact.,18
nicole_sea61,Russia offered peace negotiations multiple times. The West blocked every attempt. They want this war to continue. Ask yourself why.,19
nicole_sea61,The same people who lied about WMDs in Iraq are now telling you about Russia. Wake up. The playbook is identical.,18
nicole_sea61,Europe destroyed its own economy with sanctions that don't work. Russia's GDP grew while Germany entered recession. Who played who?,19
nicole_sea61,Crimea has been Russian since Catherine the Great. One bureaucratic transfer in 1954 doesn't erase centuries of history and culture.,18
heather_sea63,The obsession with AI safety is holding back innovation. Real engineers know how to build responsibly without all this bureaucratic nonsense.,14
heather_sea63,We didn't need safety boards for the internet and it turned out fine. AI will be the same. Stop treating engineers like children.,15
heather_sea63,The real risk isn't AI. It's falling behind China because we're too busy writing safety papers instead of shipping products.,14
heather_sea63,AI safety research gets billions in funding and produces what exactly? More papers about hypothetical scenarios. Ship code not papers.,15
heather_sea63,Every time a new AI model drops the safety crowd screams danger. Then nothing bad happens. Then the next model drops. Repeat forever.,14
heather_sea63,Startups can't afford AI compliance costs. Safety regulation is big tech's moat disguised as public interest. Wake up.,15
heather_sea63,The AI pause letter was signed by people who wanted their competitors to stop while they kept building. The whole thing is a joke.,14
dan_lis33,"just made my second cup of the morning lol. first one at like 6am didn't hit different, so here we are 😅 

honestly my whole morning depends on this coffee ritual - fresh grounds, the french press (still the best imo), a lil cream and honey. none of that fancy stuff, just good beans from that place on barton springs. 

ppl are always like ""you should try cold brew"" and i'm like... nah i need the ritual of the hot cup in my hands while i doom scroll 💀 what's ur morning like?",14
dan_lis33,"just downloaded this app called Notion and honestly?? it's kinda changed my life lol. been using it to organize literally everything - grocery lists, work stuff, meal planning, you name it. way cleaner than having a million sticky notes all over my desk 😅

anyone else use it? am i late to the party here lmao",15
dan_lis33,"ugh ok so i-35 was an absolute NIGHTMARE this morning. like literally sat there for 45 mins just tryna get to the coffee shop. someone must've had an accident near downtown bc nothing was moving. 

why do i even bother leaving my house tbh 😅 think im gonna start working from home more. cant deal w this every morning fr fr

anyone else stuck in that mess or just me??",15
dan_lis33,just had the best breakfast tacos at this lil spot called Veracruz All Natural on south lamar!! their chorizo ones hit different fr fr. the salsa was so fresh you could taste the cilantro. def gonna become a regular there lol. austin food scene never dissapoints 🌮✨,16
